URL,Version,Status,OIDs,Name,Title,Descriptino,Uses,Used,Sources
http://hl7.org/fhir/ValueSet/address-type,4.0.1,active,"2.16.840.1.113883.4.642.3.69",AddressType,AddressType,"The type of an address (physical / postal).","StructureDefinition/bc-practitioner,StructureDefinition/bc-organization,StructureDefinition/bc-address","hl7.fhir.r4.core"
http://hl7.org/fhir/ValueSet/address-use,4.0.1,active,"2.16.840.1.113883.4.642.3.67",AddressUse,AddressUse,"The use of an address.","StructureDefinition/bc-practitioner,StructureDefinition/bc-organization,StructureDefinition/bc-address","hl7.fhir.r4.core"
http://hl7.org/fhir/ValueSet/administrative-gender,4.0.1,active,"2.16.840.1.113883.4.642.3.1",AdministrativeGender,AdministrativeGender,"The gender of a person used for administrative purposes.","StructureDefinition/bc-practitioner","hl7.fhir.r4.core"
http://hl7.org/fhir/ValueSet/bundle-type,4.0.1,active,"2.16.840.1.113883.4.642.3.620",BundleType,BundleType,"Indicates the purpose of a bundle - how it is intended to be used.","StructureDefinition/bc-practitioner-bundle,StructureDefinition/bc-batch-response-bundle,StructureDefinition/bc-location-bundle,StructureDefinition/bc-organization-bundle,StructureDefinition/bc-batch-bundle","hl7.fhir.r4.core"
http://hl7.org/fhir/ValueSet/c80-practice-codes,4.0.1,active,"2.16.840.1.113883.3.88.12.80.72",PracticeSettingCodeValueSet,Practice Setting Code Value Set,"This is the code representing the clinical specialty of the clinician or provider who interacted with, treated, or provided a service to/for the patient. The value set used for clinical specialty has been limited by HITSP to the value set reproduced from HITSP C80 Table 2-149 Clinical Specialty Value Set Definition.","StructureDefinition/bc-catalogue-service,StructureDefinition/bc-organization-affiliation,StructureDefinition/bc-clinical-service","SCT"
http://hl7.org/fhir/ValueSet/care-team-category,4.0.1,draft,"2.16.840.1.113883.4.642.3.155",CareTeamCategory,Care Team category,"Indicates the type of care team.","StructureDefinition/bc-primary-network,StructureDefinition/bc-careteam","LOINC"
http://hl7.org/fhir/ValueSet/care-team-status,4.0.1,draft,"2.16.840.1.113883.4.642.3.153",CareTeamStatus,CareTeamStatus,"Indicates the status of the care team.","StructureDefinition/bc-primary-network,StructureDefinition/bc-careteam","hl7.fhir.r4.core"
http://hl7.org/fhir/ValueSet/clinical-findings,4.0.1,draft,"2.16.840.1.113883.4.642.3.232",SNOMEDCTClinicalFindings,SNOMED CT Clinical Findings,"This value set includes all the ""Clinical finding"" [SNOMED CT](http://snomed.info/sct) codes - concepts where concept is-a 404684003 (Clinical finding (finding)).","StructureDefinition/bc-primary-network,StructureDefinition/bc-careteam","SCT"
http://hl7.org/fhir/ValueSet/contact-point-system,4.0.1,active,"2.16.840.1.113883.4.642.3.71",ContactPointSystem,ContactPointSystem,"Telecommunications form for contact point.","StructureDefinition/bc-contactPoint,StructureDefinition/bc-role-relationships,StructureDefinition/bc-practitioner-role","hl7.fhir.r4.core"
http://hl7.org/fhir/ValueSet/contact-point-use,4.0.1,active,"2.16.840.1.113883.4.642.3.73",ContactPointUse,ContactPointUse,"Use of contact point.","StructureDefinition/bc-contactPoint,StructureDefinition/bc-role-relationships,StructureDefinition/bc-practitioner-role","hl7.fhir.r4.core"
http://hl7.org/fhir/ValueSet/contactentity-type,4.0.1,draft,"2.16.840.1.113883.4.642.3.416",ContactEntityType,Contact entity type,"This example value set defines a set of codes that can be used to indicate the purpose for which you would contact a contact party.","StructureDefinition/bc-organization","THO"
http://hl7.org/fhir/ValueSet/days-of-week,4.0.1,active,"2.16.840.1.113883.4.642.3.512",DaysOfWeek,DaysOfWeek,"The days of the week.","StructureDefinition/bc-catalogue-service,StructureDefinition/bc-location,StructureDefinition/bc-role-relationships,StructureDefinition/bc-practitioner-role,StructureDefinition/bc-availableTime-extension,StructureDefinition/bc-clinical-service","hl7.fhir.r4.core"
http://hl7.org/fhir/ValueSet/http-verb,4.0.1,active,"2.16.840.1.113883.4.642.3.624",HTTPVerb,HTTPVerb,"HTTP verbs (in the HTTP command line). See [HTTP rfc](https://tools.ietf.org/html/rfc7231) for details.","StructureDefinition/bc-practitioner-bundle,StructureDefinition/bc-batch-response-bundle,StructureDefinition/bc-location-bundle,StructureDefinition/bc-organization-bundle,StructureDefinition/bc-batch-bundle","hl7.fhir.r4.core"
http://hl7.org/fhir/ValueSet/identifier-type,4.0.1,active,"2.16.840.1.113883.4.642.3.45",Identifier Type Codes,IdentifierType,"A coded type for an identifier that can be used to determine which identifier to use for a specific purpose.","StructureDefinition/bc-identifier","THO (V2)"
http://hl7.org/fhir/ValueSet/identifier-use,4.0.1,active,"2.16.840.1.113883.4.642.3.57",IdentifierUse,IdentifierUse,"Identifies the purpose for this identifier, if known .","StructureDefinition/bc-identifier","hl7.fhir.r4.core"
http://hl7.org/fhir/ValueSet/issue-severity,4.0.1,active,"2.16.840.1.113883.4.642.3.408",IssueSeverity,IssueSeverity,"How the issue affects the success of the action.","StructureDefinition/bc-operation-outcome","hl7.fhir.r4.core"
http://hl7.org/fhir/ValueSet/issue-type,4.0.1,active,"2.16.840.1.113883.4.642.3.410",IssueType,IssueType,"A code that describes the type of issue.","StructureDefinition/bc-operation-outcome","hl7.fhir.r4.core"
http://hl7.org/fhir/ValueSet/languages,4.0.1,draft,"2.16.840.1.113883.4.642.3.20",CommonLanguages,Common Languages,"This value set includes common codes from BCP-47 (http://tools.ietf.org/html/bcp47)","StructureDefinition/bc-practitioner-bundle,StructureDefinition/bc-practitioner,StructureDefinition/bc-primary-network,StructureDefinition/bc-organization-affiliation,StructureDefinition/bc-location-bundle,StructureDefinition/bc-role-relationships,StructureDefinition/bc-careteam,StructureDefinition/bc-organization-bundle,StructureDefinition/bc-batch-bundle,StructureDefinition/bc-clinical-service,StructureDefinition/bc-operation-outcome,StructureDefinition/bc-batch-response-bundle,StructureDefinition/bc-catalogue-service,StructureDefinition/bc-location,StructureDefinition/bc-organization,StructureDefinition/bc-practitioner-role","hl7.terminology.r4"
http://hl7.org/fhir/ValueSet/location-mode,4.0.1,draft,"2.16.840.1.113883.4.642.3.330",LocationMode,LocationMode,"Indicates whether a resource instance represents a specific location or a class of locations.","StructureDefinition/bc-location","hl7.fhir.r4.core"
http://hl7.org/fhir/ValueSet/location-physical-type,4.0.1,draft,"2.16.840.1.113883.4.642.3.328",LocationType,Location type,"This example value set defines a set of codes that can be used to indicate the physical form of the Location.","StructureDefinition/bc-location","THO"
http://hl7.org/fhir/ValueSet/location-status,4.0.1,draft,"2.16.840.1.113883.4.642.3.332",LocationStatus,LocationStatus,"Indicates whether the location is still in use.","StructureDefinition/bc-location","hl7.fhir.r4.core"
http://hl7.org/fhir/ValueSet/name-use,4.0.1,active,"2.16.840.1.113883.4.642.3.65",NameUse,NameUse,"The use of a human name.","StructureDefinition/bc-humanName,StructureDefinition/bc-practitioner,StructureDefinition/bc-name-use-extension","hl7.fhir.r4.core"
http://hl7.org/fhir/ValueSet/operation-outcome,4.0.1,draft,"2.16.840.1.113883.4.642.3.412",OperationOutcomeCodes,Operation Outcome Codes,"Operation Outcome codes used by FHIR test servers (see Implementation file translations.xml)","StructureDefinition/bc-operation-outcome","THO"
http://hl7.org/fhir/ValueSet/organization-role,4.0.1,draft,"2.16.840.1.113883.4.642.3.880",OrganizationAffiliationRole,Organization Affiliation Role,"This example value set defines a set of codes that can be used to indicate the role of one Organization in relation to another.","StructureDefinition/bc-organization-affiliation","hl7.fhir.r4.core"
http://hl7.org/fhir/ValueSet/participant-role,4.0.1,draft,"2.16.840.1.113883.4.642.3.152",ParticipantRoles,Participant Roles,"Roles of participants that may be included in a care team.  Defined as: Is a Person, Healthcare professional (occupation) or Healthcare related organization (qualifier value).","StructureDefinition/bc-primary-network,StructureDefinition/bc-careteam","SCT"
http://hl7.org/fhir/ValueSet/program,4.0.1,draft,"2.16.840.1.113883.4.642.3.1383",Program,Program,"This value set defines an example set of codes that could be can be used to classify groupings of service-types/specialties.","StructureDefinition/bc-catalogue-service,StructureDefinition/bc-clinical-service","THO"
http://hl7.org/fhir/ValueSet/resource-types,4.0.1,active,"2.16.840.1.113883.4.642.3.27",ResourceType,ResourceType,"One of the resource types defined as part of this version of FHIR.","StructureDefinition/bc-role-relationships","hl7.fhir.r4.core"
http://hl7.org/fhir/ValueSet/search-entry-mode,4.0.1,active,"2.16.840.1.113883.4.642.3.622",SearchEntryMode,SearchEntryMode,"Why an entry is in the result set - whether it's included as a match or because of an _include requirement, or to convey information or warning information about the search process.","StructureDefinition/bc-practitioner-bundle,StructureDefinition/bc-batch-response-bundle,StructureDefinition/bc-location-bundle,StructureDefinition/bc-organization-bundle,StructureDefinition/bc-batch-bundle","hl7.fhir.r4.core"
http://hl7.org/fhir/ValueSet/service-category,4.0.1,draft,"2.16.840.1.113883.4.642.3.516",ServiceCategory,Service category,"This value set defines an example set of codes that can be used to classify groupings of service-types/specialties.","StructureDefinition/bc-catalogue-service,StructureDefinition/bc-clinical-service","THO"
http://hl7.org/fhir/ValueSet/service-provision-conditions,4.0.1,draft,"2.16.840.1.113883.4.642.3.514",ServiceProvisionConditions,ServiceProvisionConditions,"The code(s) that detail the conditions under which the healthcare service is available/offered.","StructureDefinition/bc-catalogue-service,StructureDefinition/bc-clinical-service","THO"
http://hl7.org/fhir/ValueSet/service-referral-method,4.0.1,draft,"2.16.840.1.113883.4.642.3.510",ReferralMethod,ReferralMethod,"The methods of referral can be used when referring to a specific HealthCareService resource.","StructureDefinition/bc-catalogue-service,StructureDefinition/bc-clinical-service","THO"
http://hl7.org/fhir/ValueSet/service-type,4.0.1,draft,"2.16.840.1.113883.4.642.3.518",ServiceType,Service type,"This value set defines an example set of codes of service-types.","StructureDefinition/bc-catalogue-service,StructureDefinition/bc-clinical-service","THO"
http://terminology.hl7.org/ValueSet/v2-0116,2.0.0,active,"2.16.840.1.113883.21.51",Hl7VSBedStatus,hl7VS-bedStatus,"Value Set of codes that specify the state of a bed in an inpatient setting, and is used to determine if a patient may be assigned to it or not.","StructureDefinition/bc-location","THO (V2)"
http://terminology.hl7.org/ValueSet/v3-ConfidentialityClassification,2014-03-26,active,"2.16.840.1.113883.1.11.10228",v3.ConfidentialityClassification,V3 Value SetConfidentialityClassification," Set of codes used to value Act.Confidentiality and Role.Confidentiality attribute in accordance with the definition for concept domain ""Confidentiality"".","StructureDefinition/bc-confidentiality-extension","THO (V3)"
http://terminology.hl7.org/ValueSet/v3-ServiceDeliveryLocationRoleType,3.0.0,active,"2.16.840.1.113883.1.11.17660",ServiceDeliveryLocationRoleType,ServiceDeliveryLocationRoleType,"A role of a place that further classifies the setting (e.g., accident site, road side, work site, community location) in which services are delivered.","StructureDefinition/bc-location","THO (V3)"
https://terminology.hlth.gov.bc.ca/ProviderLocationRegistry/ValueSet/bc-address-validation-status-value-set,1.0.0,active,,AddressValidationStatusVS,BC Address Validation Status Value Set,"BC address validation status value set.","StructureDefinition/bc-address-validation-status-extension","Other"
https://terminology.hlth.gov.bc.ca/ProviderLocationRegistry/ValueSet/bc-communication-purpose-value-set,1.0.0,active,,CommunicationPurposeVS,BC Communication Purpose Value Set,"BC communication purpose value set.","StructureDefinition/bc-communication-purpose-code-extension","Other"
https://terminology.hlth.gov.bc.ca/ProviderLocationRegistry/ValueSet/bc-end-reason-value-set,1.0.0,active,,EndReasonVS,BC End Reason Value Set,"BC end reason value set.","StructureDefinition/bc-end-reason-extension","Other"
https://terminology.hlth.gov.bc.ca/ProviderLocationRegistry/ValueSet/bc-expertise-value-set,1.0.0,active,,ExpertiseVS,BC Expertise Value Set,"BC Expertise value set.","StructureDefinition/bc-practitioner-role","hl7.fhir.ca.baseline,Other"
https://terminology.hlth.gov.bc.ca/ProviderLocationRegistry/ValueSet/bc-hds-type-value-set,1.0.0,active,,HealthDeliverySiteTypeVS,BC Health Delivery Site Type Value Set,"BC ealth Delivery Site Type Value set.","StructureDefinition/bc-health-delivery-site-type-extension","Other"
https://terminology.hlth.gov.bc.ca/ProviderLocationRegistry/ValueSet/bc-language-value-set,1.0.0,active,,LanguageVS,BC Language Value Set,"BC Language value set.","StructureDefinition/bc-practitioner","Other"
https://terminology.hlth.gov.bc.ca/ProviderLocationRegistry/ValueSet/bc-license-status-class-value-set,1.0.0,active,,LicenseStatusClassVS,BC License Status Class Value Set,"BC specific license status class value set.","StructureDefinition/bc-license-status-extension","Other"
https://terminology.hlth.gov.bc.ca/ProviderLocationRegistry/ValueSet/bc-license-status-reason-value-set,1.0.0,active,,LicenseReasonVS,BC License Status Reason Value Set,"BC specific license status reason value set.","StructureDefinition/bc-license-status-extension","Other"
https://terminology.hlth.gov.bc.ca/ProviderLocationRegistry/ValueSet/bc-license-status-value-set,1.0.0,active,,LicenseStatusVS,BC License Status Value Set,"BC specific license status value set.","StructureDefinition/bc-license-status-extension","THO (V3),Other"
https://terminology.hlth.gov.bc.ca/ProviderLocationRegistry/ValueSet/bc-organization-role-value-set,1.0.0,active,,OrganizationRoleVS,BC Organization Role Code Value Set,"BC Organization Role Codes.","StructureDefinition/bc-organization","Other"
https://terminology.hlth.gov.bc.ca/ProviderLocationRegistry/ValueSet/bc-practitioner-role-value-set,1.0.0,active,,PractitionerRoleVS,BC Practitioner Role Code Value Set,"BC Practitioner Role Codes.","StructureDefinition/bc-practitioner-role","Other"
https://terminology.hlth.gov.bc.ca/ProviderLocationRegistry/ValueSet/bc-qualification-value-set,1.0.0,active,,PracQualificationVS,BC Practitioner Qualification Value Set,"BC specific qualification value set.","StructureDefinition/bc-practitioner","hl7.fhir.ca.baseline,Other"
https://terminology.hlth.gov.bc.ca/ProviderLocationRegistry/ValueSet/bc-relationship-type-value-set,1.0.0,active,,RelationshipTypeVS,BC Relationship Type Value Set,"BC relationship type value set.",,"Other"
